Post Name,Post URL,Not Found,Posts with Issues
Professional WorPress Website or Online Store on a Monthly Subscription - Solomon Designs,https://solomondesigns.co.uk,Page Found,0
Professional WorPress Website or Online Store on a Monthly Subscription - Solomon Designs,https://solomondesigns.co.uk#content,Page Found,0
Professional WorPress Website or Online Store on a Monthly Subscription - Solomon Designs,https://solomondesigns.co.uk/,Page Found,0
Cart - Solomon Designs,https://solomondesigns.co.uk/cart-page/,Page Found,0
Google Page Speed Insights Optimization starting £300 for a Website,https://solomondesigns.co.uk/google-pagespeed-insights-optimization/,Page Found,0
Technical SEO - Solomon Designs,https://solomondesigns.co.uk/technical-seo/,Page Found,0
Solomon Designs Top Rated Wordpress Web Development,https://solomondesigns.co.uk/solomon-designs-services/,Page Found,0
,,Total Pages with Issues:,0
